{
  "id": "sample-rpg-game",
  "title": "Sample RPG Adventure",
  "processName": "SampleGame.exe",
  "version": "1.0.0",
  "supportedPlatforms": ["steam", "epic"],
  "cheats": [
    {
      "id": "god_mode",
      "name": "Vida Infinita (Modo Deus)",
      "category": "Jogador",
      "type": "aob_patch",
      "pattern": "89 46 24 48 8B 05 ?? ?? ?? ??",
      "replace": "90 90 90 48 8B 05 ?? ?? ?? ??",
      "hotkey": "F1"
    },
    {
      "id": "infinite_stamina",
      "name": "Estamina Infinita",
      "category": "Jogador",
      "type": "aob_patch",
      "pattern": "F3 0F 11 43 1C 48 8B 5C 24 30",
      "replace": "90 90 90 90 90 48 8B 5C 24 30",
      "hotkey": "F2"
    },
    {
      "id": "infinite_gold",
      "name": "Ouro Infinito (999,999)",
      "category": "Recursos",
      "type": "pointer_freeze",
      "baseModule": "SampleGame.exe",
      "pointerChain": ["0x01B34020", "0x40", "0x118"],
      "valueType": "int32",
      "value": 999999,
      "hotkey": "F3"
    },
    {
      "id": "game_speed",
      "name": "Velocidade do Jogo (Speedhack)",
      "category": "Mundo",
      "type": "speedhack",
      "value": 2.5,
      "hotkey": "F4"
    }
  ]
}
